{
  "$schema": "http://json-schema.org/schema#",
  "title": "Schema title",
  "description": "Schema description",
  "type": "object",
  "properties": {
    "_id": {
      "type": "object",
      "properties": {
        "$oid": {
          "type": "string"
        }
      }
    },
    "author": {
      "type": "array",
      "items": {
        "type": "string"
      }
    },
    "isbn": {
      "type": "string"
    },
    "price": {
      "type": "object",
      "properties": {
        "currency": {
          "type": "string"
        },
        "discount": {
          "type": "number"
        },
        "msrp": {
          "type": "number"
        }
      }
    },
    "publicationYear": {
      "type": "number"
    },
    "tags": {
      "type": "array",
      "items": {
        "type": "string"
      }
    },
    "title": {
      "type": "string"
    }
  }
}
